{"meta":{"hostname":"h1","tool_version":"0.1","json_schema_version":"2"},"summary":{"finding_count_total":2,"finding_count_emitted":2},"results":[{"scanner":"network","finding_count":1,"findings":[{"id":"n1","title":"TCP 22 listening","severity":"info","risk_score":10,"metadata":{"state":"LISTEN","port":22}}]} , {"scanner":"suid","finding_count":1,"findings":[{"id":"s1","title":"SUID /usr/bin/pppd","severity":"medium","risk_score":50,"metadata":{"suid":"true","path":"/usr/bin/pppd"}}]}],"collection_warnings":[],"scanner_errors":[],"summary_extension":{"total_risk_score":60,"emitted_risk_score":60}}
