{"meta":{"hostname":"h2","tool_version":"0.1","json_schema_version":"2"},"summary":{"finding_count_total":1,"finding_count_emitted":1},"results":[{"scanner":"modules","finding_count":1,"findings":[{"id":"m1","title":"Kernel module br_netfilter","severity":"info","risk_score":10,"metadata":{"module":"br_netfilter"}}]}],"collection_warnings":[],"scanner_errors":[],"summary_extension":{"total_risk_score":10,"emitted_risk_score":10}}
