{"meta":{"hostname":"h5","tool_version":"0.1","json_schema_version":"2"},"summary":{"finding_count_total":2,"finding_count_emitted":2},"results":[{"scanner":"modules","finding_count":2,"findings":[{"id":"m2","title":"Kernel module xt_MASQUERADE","severity":"info","risk_score":10,"metadata":{"module":"xt_MASQUERADE"}},{"id":"m3","title":"Kernel module uncommonX","severity":"info","risk_score":10,"metadata":{"module":"uncommonX"}}]}],"collection_warnings":[],"scanner_errors":[],"summary_extension":{"total_risk_score":20,"emitted_risk_score":20}}
