{"meta":{"hostname":"h4","tool_version":"0.1","json_schema_version":"2"},"summary":{"finding_count_total":3,"finding_count_emitted":3},"results":[{"scanner":"network","finding_count":2,"findings":[{"id":"n2","title":"TCP 53 listening","severity":"info","risk_score":10,"metadata":{"state":"LISTEN","port":53}},{"id":"n3","title":"TCP 443 listening","severity":"info","risk_score":10,"metadata":{"state":"LISTEN","port":443}}]},{"scanner":"suid","finding_count":1,"findings":[{"id":"s2","title":"SUID /usr/bin/newbin","severity":"low","risk_score":30,"metadata":{"suid":"true","path":"/usr/bin/newbin"}}]}],"collection_warnings":[],"scanner_errors":[],"summary_extension":{"total_risk_score":50,"emitted_risk_score":50}}
